{
  "aliases": [],
  "description": [
    "Display job status or substitute job specifications. This entry documents the Bash builtin and its shell-state effects."
  ],
  "examples": [],
  "id": "builtin.jobs",
  "kind": "builtin",
  "language": "en",
  "name": "jobs",
  "pitfalls": [],
  "portability": [
    "Options beyond POSIX may be Bash-specific."
  ],
  "related": [],
  "security": [],
  "sources": [
    "https://www.gnu.org/software/bash/manual/bash.html#Job-Control-Builtins"
  ],
  "summary": "Display job status or substitute job specifications.",
  "synopsis": "jobs [-lnprs] [jobspec ...] or jobs -x command [args]",
  "tags": [
    "builtin",
    "jobs"
  ]
}
