{
  "aliases": [],
  "description": [
    "یک command list را در محیط shell فعلی اجرا می‌کند."
  ],
  "examples": [],
  "id": "syntax.group-command",
  "kind": "syntax",
  "language": "fa",
  "name": "group-command",
  "related": [],
  "sources": [
    "https://www.gnu.org/software/bash/manual/bash.html#Shell-Compound-Commands"
  ],
  "summary": "یک command list را در محیط shell فعلی اجرا می‌کند.",
  "synopsis": "{ list; }",
  "tags": [
    "syntax",
    "compound-command"
  ]
}
