{
  "aliases": [],
  "description": [
    "Add or rotate entries in the directory stack. This entry documents the Bash builtin and its shell-state effects."
  ],
  "examples": [],
  "id": "builtin.pushd",
  "kind": "builtin",
  "language": "en",
  "name": "pushd",
  "pitfalls": [],
  "portability": [
    "Options beyond POSIX may be Bash-specific."
  ],
  "related": [],
  "security": [],
  "sources": [
    "https://www.gnu.org/software/bash/manual/bash.html#Bash-Builtins"
  ],
  "summary": "Add or rotate entries in the directory stack.",
  "synopsis": "pushd [-n] [+N | -N | dir]",
  "tags": [
    "builtin",
    "pushd"
  ]
}
