{
  "aliases": [],
  "description": [
    "Automatically mark modified or created variables for export."
  ],
  "examples": [],
  "id": "option.allexport",
  "kind": "option",
  "language": "en",
  "name": "allexport",
  "related": [
    "builtin.set"
  ],
  "sources": [
    "https://www.gnu.org/software/bash/manual/bash.html#The-Set-Builtin"
  ],
  "summary": "Automatically mark modified or created variables for export.",
  "synopsis": "set -o allexport | set +o allexport",
  "tags": [
    "option",
    "set"
  ]
}
