{
  "aliases": [],
  "description": [
    "Quoting controls which characters and expansions retain literal meaning."
  ],
  "examples": [],
  "id": "syntax.quoting",
  "kind": "syntax",
  "language": "en",
  "name": "quoting",
  "pitfalls": [],
  "portability": [],
  "related": [],
  "security": [],
  "sources": [
    "https://www.gnu.org/software/bash/manual/bash.html#Quoting"
  ],
  "summary": "Quoting controls which characters and expansions retain literal meaning.",
  "synopsis": "'single quoted'  \"double quoted\"  \\escaped",
  "tags": [
    "syntax",
    "quoting"
  ]
}
