{
  "aliases": [],
  "description": [
    "همیشه وضعیت موفق برمی‌گرداند. این مدخل builtin و اثر آن بر وضعیت پوسته را مستند می‌کند."
  ],
  "examples": [],
  "id": "builtin.true",
  "kind": "builtin",
  "language": "fa",
  "name": "true",
  "pitfalls": [],
  "portability": [
    "گزینه‌های فراتر از POSIX ممکن است مخصوص Bash باشند."
  ],
  "related": [],
  "security": [],
  "sources": [
    "https://www.gnu.org/software/bash/manual/bash.html#Bash-Builtins"
  ],
  "summary": "همیشه وضعیت موفق برمی‌گرداند.",
  "synopsis": "true",
  "tags": [
    "builtin",
    "true"
  ]
}
