{
  "aliases": [],
  "description": [
    "یک Job را به foreground منتقل می‌کند. این مدخل builtin و اثر آن بر وضعیت پوسته را مستند می‌کند."
  ],
  "examples": [],
  "id": "builtin.fg",
  "kind": "builtin",
  "language": "fa",
  "name": "fg",
  "pitfalls": [],
  "portability": [
    "گزینه‌های فراتر از POSIX ممکن است مخصوص Bash باشند."
  ],
  "related": [],
  "security": [],
  "sources": [
    "https://www.gnu.org/software/bash/manual/bash.html#Job-Control-Builtins"
  ],
  "summary": "یک Job را به foreground منتقل می‌کند.",
  "synopsis": "fg [job_spec]",
  "tags": [
    "builtin",
    "fg"
  ]
}
