{
  "aliases": [],
  "description": [
    "پس از ترجمه locale، رشته‌های $\"...\" را دوباره expand نمی‌کند."
  ],
  "examples": [],
  "id": "shopt.noexpand_translation",
  "kind": "shopt",
  "language": "fa",
  "name": "noexpand_translation",
  "related": [
    "builtin.shopt"
  ],
  "sources": [
    "https://www.gnu.org/software/bash/manual/bash.html#The-Shopt-Builtin"
  ],
  "summary": "پس از ترجمه locale، رشته‌های $\"...\" را دوباره expand نمی‌کند.",
  "synopsis": "shopt -s noexpand_translation | shopt -u noexpand_translation",
  "tags": [
    "shopt",
    "option"
  ]
}
